{
  "schema_version": "0.2",
  "benchmark_id": "PRE_G2_PRODUCT_V0_1",
  "benchmark_kind": "PRODUCT",
  "state": "DRAFT_UNFROZEN",
  "g1_gate_state": "APPROVED_REFERENCE_PROVIDED",
  "g1_disposition_id": "HUMAN_G1_DISPOSITION_2026-09-05_D1_D2_v0.1",
  "g1_disposition_sha256": "ed6489fe1085b5aec1b594970dd1c574b57bd6bbd25a659643e9bd1b7b72d8ef",
  "g2_passed": false,
  "canonical_s2_authority": false,
  "publication_authority": false,
  "assessment_effect": "NONE",
  "private_membership_location": "S3_CONTROLLED",
  "private_labels_location": "S3_CONTROLLED",
  "commitment_scheme": "HMAC_SHA256_DOMAIN_CANONICAL_JSON_V1",
  "membership_commitment": null,
  "label_commitment": null,
  "boundary_semantics": {
    "source_d1_canonical_json_sha256": "7d270002094dcdecb703d5b70ef2268e4869005c284ffd98db3eb936641a78cb",
    "allowed_dispositions": [
      "ABSTAIN",
      "BORDERLINE",
      "EXCLUDE",
      "INCLUDE"
    ],
    "required_g2_coverage_dispositions": [
      "BORDERLINE",
      "EXCLUDE",
      "INCLUDE"
    ],
    "resolved_adjudication_states": [
      "ADJUDICATED",
      "AGREE"
    ],
    "unresolved_adjudication_state": "DISAGREE_UNADJUDICATED",
    "rationale_required": true,
    "binary_projection": {
      "projection_id": "D1_INCLUDE_EXCLUDE_BINARY_V1",
      "positive_disposition": "INCLUDE",
      "negative_disposition": "EXCLUDE",
      "excluded_human_dispositions": [
        "ABSTAIN",
        "BORDERLINE"
      ],
      "model_prediction_domain": [
        "ABSTAIN",
        "BORDERLINE",
        "EXCLUDE",
        "INCLUDE"
      ],
      "unresolved_adjudication_excluded_from_binary_metrics": true,
      "model_borderline_on_human_include_counts_as_effective_false_negative": true,
      "model_abstain_on_human_include_counts_as_effective_false_negative": true,
      "missing_prediction_on_human_include_counts_as_effective_false_negative": true,
      "probability_field": "probability_include"
    }
  },
  "required_strata": [
    "AMBIGUOUS_BIOSIGNAL",
    "CLINICAL",
    "CONSUMER",
    "ENTERTAINMENT_XR",
    "MULTI_JURISDICTION",
    "MULTILINGUAL",
    "NONTRADITIONAL_FORM_FACTOR",
    "RESEARCH",
    "WELLNESS",
    "WORKPLACE"
  ],
  "double_label_subset_required": true,
  "adjudication_states": [
    "ADJUDICATED",
    "AGREE",
    "DISAGREE_UNADJUDICATED"
  ]
}
